<?xml version="1.0"?>
<!DOCTYPE Report
[
<!ELEMENT Report (General ,(Doc|BPT)) >
<!ATTLIST Report ver CDATA #REQUIRED tmZone CDATA #REQUIRED>

<!ELEMENT General ( DocLocation ) >
<!ATTLIST General productName CDATA #REQUIRED productVer CDATA #REQUIRED os CDATA #REQUIRED host CDATA #REQUIRED qcserver CDATA #IMPLIED qcproject CDATA #IMPLIED  >

<!ELEMENT BPT (DName,Res,DVer?,TSet?,TInst?,NodeArgs,AdditionalInfo*,Doc*) >
<!ATTLIST BPT rID ID #REQUIRED >

<!ELEMENT Doc (DName,ConfName?,Res,DVer?,TSet?,TInst?,RunType?,DT?,AdditionalInfo*,Step*,DIter*,Step*,Action*,Doc*,Summary?,TestMaintenanceSummary*,NodeArgs?) >
<!ATTLIST Doc rID ID #REQUIRED type (Test|BC|BPTWrapperTest|Flow|Group) "Test" productName CDATA #REQUIRED BCIter CDATA #IMPLIED >

<!ELEMENT RunType ( #PCDATA )>
<!ATTLIST RunType fmStep (False|True) "False" batch (False|True) "False" upDesc (False|True) "False" upChk (False|True) "False" upAS (False|True) "False">

<!ELEMENT DName ( #PCDATA ) >

<!ELEMENT ConfName ( #PCDATA ) >

<!ELEMENT Res ( #PCDATA ) >

<!ELEMENT AdditionalInfo (AdditionalDataName,AdditionalDataValue ) >

<!ELEMENT AdditionalDataName ( #PCDATA ) >

<!ELEMENT AdditionalDataValue ( #PCDATA ) >

<!ELEMENT DVer ( #PCDATA ) >

<!ELEMENT TSet ( #PCDATA ) >

<!ELEMENT TInst ( #PCDATA ) >

<!ELEMENT DIter (Step*,Action+,Summary?,NodeArgs)>
<!ATTLIST DIter rID ID #REQUIRED iterID CDATA #REQUIRED>

<!ELEMENT DocLocation ( #PCDATA )>

<!ELEMENT Action (AName,AIter*,(Step|HtmlStep|Action)*,Summary,ActionMaintenanceSummary*,NodeArgs ) >
<!ATTLIST Action rID ID #REQUIRED>

<!ELEMENT AIter ((Step|HtmlStep|Action)*,Summary?,NodeArgs) >
<!ATTLIST AIter rID ID #REQUIRED iterID CDATA #REQUIRED>

<!ELEMENT AName ( #PCDATA ) >

<!ELEMENT TestMaintenanceSummary (ActionMaintenanceSummary*) >
<!ATTLIST TestMaintenanceSummary ObjectsAdded CDATA #REQUIRED ObjectsUpdated CDATA #REQUIRED StepsUpdated CDATA #REQUIRED StepsComments CDATA #REQUIRED><!ELEMENT ActionMaintenanceSummary (ObjectChange* ) >
<!ATTLIST ActionMaintenanceSummary Action CDATA #REQUIRED Objects CDATA #REQUIRED Updated CDATA #REQUIRED LinesTotal CDATA #REQUIRED Added CDATA #REQUIRED LinesUpdated CDATA #REQUIRED>

<!ELEMENT ObjectChange  (Hierarchy, PropertyChangeList* ) >
<!ATTLIST ObjectChange Operation CDATA #IMPLIED OriginalRepository CDATA #IMPLIED>

<!ELEMENT PropertyChangeList (PropertyDef*) >

<!ELEMENT PropertyDef (OriginalValue, NewValue) >
<!ATTLIST PropertyDef PropName CDATA #REQUIRED OriginRegularExpression (True|False) "False" NewRegularExpression (True|False) "False" AddedProperty (True|False) "False" >

<!ELEMENT OriginalValue ( #PCDATA )>

<!ELEMENT NewValue ( #PCDATA )>

<!ELEMENT Hierarchy  (ObjectName, Hierarchy*) >
<!ATTLIST Hierarchy MicClass CDATA #REQUIRED>

<!ELEMENT ObjectName  ( #PCDATA ) >

<!ELEMENT Step (Obj,Details,Time,TimeTick* ,(Step|HtmlStep|Doc)*,NodeArgs) >
<!ATTLIST Step rID ID #REQUIRED retval CDATA #IMPLIED>

<!ELEMENT HtmlStep (HTML,TimeTick*,(Step|HtmlStep|Doc)*,NodeArgs) >
<!ATTLIST HtmlStep rID ID #REQUIRED >

<!ELEMENT Obj ( #PCDATA ) >
<!ATTLIST Obj plainTxt (False|True) "True">

<!ELEMENT Details ( #PCDATA ) >
<!ATTLIST Details plainTxt (False|True) "True">

<!ELEMENT Time ( #PCDATA ) >

<!ELEMENT HTML ( #PCDATA ) >

<!ELEMENT Disp ( #PCDATA ) >

<!ELEMENT TimeTick ( #PCDATA ) >

<!ELEMENT NodeArgs (Disp,TopPane?,BtmPane?,ExtendedInfo? )>
<!ATTLIST NodeArgs eType CDATA #REQUIRED icon CDATA #REQUIRED nRep CDATA #REQUIRED UserNote CDATA #IMPLIED filter (False|True) "True">
<!ATTLIST NodeArgs status (Passed|Failed|Done|Warning|Information) "Done">
<!ATTLIST NodeArgs iconSel CDATA #IMPLIED nType CDATA #IMPLIED MovieMarker CDATA "">
<!ATTLIST NodeArgs Source CDATA #IMPLIED SourceLine CDATA #IMPLIED >

<!ELEMENT TopPane (Path)>

<!ELEMENT BtmPane ( (Path|WR)?,ASHilite?)>
<!ATTLIST BtmPane vType CDATA "HTML">

<!ELEMENT Path ( #PCDATA ) >

<!ELEMENT ASHilite ( #PCDATA ) >

<!ELEMENT WR ( #PCDATA ) >

<!ELEMENT ExtendedInfo ( StepData ) >

<!ATTLIST ExtendedInfo StepType CDATA #REQUIRED>
<!ELEMENT DT (NodeArgs) >
<!ATTLIST DT rID ID #REQUIRED>

<!ELEMENT Summary (Param*)>
<!ATTLIST Summary sTime CDATA #IMPLIED eTime CDATA #IMPLIED passed CDATA #IMPLIED failed CDATA #IMPLIED warnings CDATA #IMPLIED retval CDATA #IMPLIED stopped (False|True) "False" >

<!ELEMENT Param (ParamName,ParamVal)+ >
<!ATTLIST Param paramInOut (In|Out) "In">

<!ELEMENT ParamName ( #PCDATA ) >

<!ELEMENT ParamVal ( #PCDATA ) >

]
>
<Report ver="2.0" tmZone="中国标准时间">
<General productName="QuickTest Professional" productVer="11.00" os="Windows XP" host="TY-GH"><DocLocation><![CDATA[C:\Program Files\HP\QuickTest Professional\Tests\Sumitomo\Script\Case3_VehiMsg_LastSubm_BaoYangTimeSetAndReply]]></DocLocation></General>
<Doc rID="T1"   productName= "QuickTest Professional"  >
<DName><![CDATA[Case3_VehiMsg_LastSubm_BaoYangTimeSetAndReply]]></DName>
<Res><![CDATA[Res3]]></Res>
<DT rID="T2">
<NodeArgs eType="Table" icon="2" nRep="4" filter="False" >
<Disp><![CDATA[Run-Time Data Table]]></Disp>
<BtmPane vType="Table">
<Path><![CDATA[Default.xls]]></Path>
</BtmPane>
</NodeArgs>
</DT>
<Action rID="T3">
<AName><![CDATA[Action1]]></AName>
<Action rID="T4">
<AName><![CDATA[Action1 [Login]]]></AName>
<Step rID="T5">
<Obj plainTxt="False" ><![CDATA[SystemUtil]]></Obj>
<Details plainTxt="False" ><![CDATA[SystemUtil]]></Details>
<Time><![CDATA[2014-8-15 - 15:24:35]]></Time>
<TimeTick>1408087475</TimeTick>
<Step rID="T6">
<Obj plainTxt="False" ><![CDATA[Run "iexplore.exe",1]]></Obj>
<Details plainTxt="False" ><![CDATA[Run "iexplore.exe",1]]></Details>
<Time><![CDATA[2014-8-15 - 15:24:35]]></Time>
<TimeTick>1408087475</TimeTick>
<NodeArgs eType="Replay" icon="5" nRep="11" status="Passed" Source="Action1 [Login]" SourceLine="5" >
<Disp><![CDATA[Run "iexplore.exe",1]]></Disp>
</NodeArgs>
</Step>
<NodeArgs eType="Replay" icon="5" nRep="10" status="Passed" Source="Action1 [Login]" SourceLine="5" >
<Disp><![CDATA[SystemUtil]]></Disp>
</NodeArgs>
</Step>
<Step rID="T7">
<Obj plainTxt="False" ><![CDATA[住友]]></Obj>
<Details plainTxt="False" ><![CDATA[Browser]]></Details>
<Time><![CDATA[2014-8-15 - 15:24:39]]></Time>
<TimeTick>1408087479</TimeTick>
<Step rID="T8">
<Obj plainTxt="False" ><![CDATA[登录页]]></Obj>
<Details plainTxt="False" ><![CDATA[Page]]></Details>
<Time><![CDATA[2014-8-15 - 15:24:39]]></Time>
<TimeTick>1408087479</TimeTick>
<Step rID="T9">
<Obj plainTxt="False" ><![CDATA[帐户.Exist]]></Obj>
<Details plainTxt="False" ><![CDATA["Object exists"]]></Details>
<Time><![CDATA[2014-8-15 - 15:24:39]]></Time>
<TimeTick>1408087479</TimeTick>
<NodeArgs eType="Replay" icon="8" nRep="15" Source="Action1 [Login]" SourceLine="7" >
<Disp><![CDATA[帐户.Exist]]></Disp>
</NodeArgs>
</Step>
<Step rID="T10">
<Obj plainTxt="False" ><![CDATA[帐户.Set]]></Obj>
<Details plainTxt="False" ><![CDATA["AutoProdtest"]]></Details>
<Time><![CDATA[2014-8-15 - 15:24:39]]></Time>
<TimeTick>1408087479</TimeTick>
<NodeArgs eType="Replay" icon="8" nRep="18" Source="Action1 [Login]" SourceLine="12" >
<Disp><![CDATA[帐户.Set]]></Disp>
</NodeArgs>
</Step>
<Step rID="T11">
<Obj plainTxt="False" ><![CDATA[密码.Exist]]></Obj>
<Details plainTxt="False" ><![CDATA["Object exists"]]></Details>
<Time><![CDATA[2014-8-15 - 15:24:39]]></Time>
<TimeTick>1408087479</TimeTick>
<NodeArgs eType="Replay" icon="8" nRep="20" Source="Action1 [Login]" SourceLine="15" >
<Disp><![CDATA[密码.Exist]]></Disp>
</NodeArgs>
</Step>
<Step rID="T12">
<Obj plainTxt="False" ><![CDATA[密码.Set]]></Obj>
<Details plainTxt="False" ><![CDATA["123"]]></Details>
<Time><![CDATA[2014-8-15 - 15:24:39]]></Time>
<TimeTick>1408087479</TimeTick>
<NodeArgs eType="Replay" icon="8" nRep="23" Source="Action1 [Login]" SourceLine="16" >
<Disp><![CDATA[密码.Set]]></Disp>
</NodeArgs>
</Step>
<Step rID="T13">
<Obj plainTxt="False" ><![CDATA[登录.Exist]]></Obj>
<Details plainTxt="False" ><![CDATA["Object exists"]]></Details>
<Time><![CDATA[2014-8-15 - 15:24:39]]></Time>
<TimeTick>1408087479</TimeTick>
<NodeArgs eType="Replay" icon="9" nRep="25" Source="Action1 [Login]" SourceLine="18" >
<Disp><![CDATA[登录.Exist]]></Disp>
</NodeArgs>
</Step>
<Step rID="T14">
<Obj plainTxt="False" ><![CDATA[登录.Click]]></Obj>
<Details plainTxt="False" ><![CDATA[]]></Details>
<Time><![CDATA[2014-8-15 - 15:24:39]]></Time>
<TimeTick>1408087479</TimeTick>
<NodeArgs eType="Replay" icon="9" nRep="28" Source="Action1 [Login]" SourceLine="19" >
<Disp><![CDATA[登录.Click]]></Disp>
</NodeArgs>
</Step>
<NodeArgs eType="Context" icon="7" nRep="14" Source="Action1 [Login]" SourceLine="7" >
<Disp><![CDATA[登录页]]></Disp>
</NodeArgs>
</Step>
<Step rID="T15">
<Obj plainTxt="False" ><![CDATA[主页]]></Obj>
<Details plainTxt="False" ><![CDATA[Page]]></Details>
<Time><![CDATA[2014-8-15 - 15:24:41]]></Time>
<TimeTick>1408087481</TimeTick>
<Step rID="T16">
<Obj plainTxt="False" ><![CDATA[主页.Sync]]></Obj>
<Details plainTxt="False" ><![CDATA[]]></Details>
<Time><![CDATA[2014-8-15 - 15:24:41]]></Time>
<TimeTick>1408087481</TimeTick>
<NodeArgs eType="Replay" icon="7" nRep="32" Source="Action1 [Login]" SourceLine="22" >
<Disp><![CDATA[主页.Sync]]></Disp>
</NodeArgs>
</Step>
<NodeArgs eType="Context" icon="7" nRep="31" Source="Action1 [Login]" SourceLine="22" >
<Disp><![CDATA[主页]]></Disp>
</NodeArgs>
</Step>
<NodeArgs eType="Context" icon="6" nRep="13" Source="Action1 [Login]" SourceLine="7" >
<Disp><![CDATA[住友]]></Disp>
</NodeArgs>
</Step>
<Step rID="T17">
<Obj ><![CDATA[登录成功]]></Obj>
<Details ><![CDATA[期望登录用户名: AutoProdtest实际登录用户名是: AutoProdtest]]></Details>
<Time><![CDATA[2014-8-15 - 15:24:41]]></Time>
<TimeTick>1408087481</TimeTick>
<NodeArgs eType="User" icon="10" nRep="34" status="Passed" Source="Action1 [Login]" SourceLine="35" >
<Disp><![CDATA[登录成功]]></Disp>
</NodeArgs>
</Step>
<Summary sTime="2014-8-15 - 15:24:27" eTime="2014-8-15 - 15:24:41" passed="2" failed="0" warnings="0" ></Summary>
<NodeArgs eType="StartAction" icon="4" nRep="7" status="Passed" >
<Disp><![CDATA[Action1 [Login] Summary]]></Disp>
</NodeArgs>
</Action>
<Action rID="T18">
<AName><![CDATA[Action1 [IntoVehiInfoFramePage]]]></AName>
<Step rID="T19">
<Obj plainTxt="False" ><![CDATA[住友]]></Obj>
<Details plainTxt="False" ><![CDATA[Browser]]></Details>
<Time><![CDATA[2014-8-15 - 15:24:42]]></Time>
<TimeTick>1408087482</TimeTick>
<Step rID="T20">
<Obj plainTxt="False" ><![CDATA[主页]]></Obj>
<Details plainTxt="False" ><![CDATA[Page]]></Details>
<Time><![CDATA[2014-8-15 - 15:24:42]]></Time>
<TimeTick>1408087482</TimeTick>
<Step rID="T21">
<Obj plainTxt="False" ><![CDATA[左导航栏]]></Obj>
<Details plainTxt="False" ><![CDATA[Frame]]></Details>
<Time><![CDATA[2014-8-15 - 15:24:42]]></Time>
<TimeTick>1408087482</TimeTick>
<Step rID="T22">
<Obj plainTxt="False" ><![CDATA[查询中心.Exist]]></Obj>
<Details plainTxt="False" ><![CDATA["Object exists"]]></Details>
<Time><![CDATA[2014-8-15 - 15:24:42]]></Time>
<TimeTick>1408087482</TimeTick>
<NodeArgs eType="Replay" icon="12" nRep="41" Source="Action1 [IntoVehiInfoFramePage]" SourceLine="3" >
<Disp><![CDATA[查询中心.Exist]]></Disp>
</NodeArgs>
</Step>
<Step rID="T23">
<Obj plainTxt="False" ><![CDATA[查询中心.Click]]></Obj>
<Details plainTxt="False" ><![CDATA[]]></Details>
<Time><![CDATA[2014-8-15 - 15:24:42]]></Time>
<TimeTick>1408087482</TimeTick>
<NodeArgs eType="Replay" icon="12" nRep="44" Source="Action1 [IntoVehiInfoFramePage]" SourceLine="4" >
<Disp><![CDATA[查询中心.Click]]></Disp>
</NodeArgs>
</Step>
<NodeArgs eType="Context" icon="11" nRep="40" Source="Action1 [IntoVehiInfoFramePage]" SourceLine="3" >
<Disp><![CDATA[左导航栏]]></Disp>
</NodeArgs>
</Step>
<NodeArgs eType="Context" icon="7" nRep="39" Source="Action1 [IntoVehiInfoFramePage]" SourceLine="3" >
<Disp><![CDATA[主页]]></Disp>
</NodeArgs>
</Step>
<Step rID="T24">
<Obj plainTxt="False" ><![CDATA[主页_查询中心]]></Obj>
<Details plainTxt="False" ><![CDATA[Page]]></Details>
<Time><![CDATA[2014-8-15 - 15:24:43]]></Time>
<TimeTick>1408087483</TimeTick>
<Step rID="T25">
<Obj plainTxt="False" ><![CDATA[查询中心]]></Obj>
<Details plainTxt="False" ><![CDATA[Frame]]></Details>
<Time><![CDATA[2014-8-15 - 15:24:43]]></Time>
<TimeTick>1408087483</TimeTick>
<Step rID="T26">
<Obj plainTxt="False" ><![CDATA[位置:查询中心.Exist]]></Obj>
<Details plainTxt="False" ><![CDATA["Object exists"]]></Details>
<Time><![CDATA[2014-8-15 - 15:24:43]]></Time>
<TimeTick>1408087483</TimeTick>
<NodeArgs eType="Replay" icon="12" nRep="48" Source="Action1 [IntoVehiInfoFramePage]" SourceLine="8" >
<Disp><![CDATA[位置:查询中心.Exist]]></Disp>
</NodeArgs>
</Step>
<NodeArgs eType="Context" icon="11" nRep="47" Source="Action1 [IntoVehiInfoFramePage]" SourceLine="8" >
<Disp><![CDATA[查询中心]]></Disp>
</NodeArgs>
</Step>
<NodeArgs eType="Context" icon="7" nRep="46" Source="Action1 [IntoVehiInfoFramePage]" SourceLine="8" >
<Disp><![CDATA[主页_查询中心]]></Disp>
</NodeArgs>
</Step>
<NodeArgs eType="Context" icon="6" nRep="38" Source="Action1 [IntoVehiInfoFramePage]" SourceLine="3" >
<Disp><![CDATA[住友]]></Disp>
</NodeArgs>
</Step>
<Step rID="T27">
<Obj ><![CDATA[进入查询中心页成功]]></Obj>
<Details ><![CDATA[期望位置:您的位置：>> 查询中心  实际位置:您的位置：>> 查询中心]]></Details>
<Time><![CDATA[2014-8-15 - 15:24:43]]></Time>
<TimeTick>1408087483</TimeTick>
<NodeArgs eType="User" icon="10" nRep="50" status="Passed" Source="Action1 [IntoVehiInfoFramePage]" SourceLine="11" >
<Disp><![CDATA[进入查询中心页成功]]></Disp>
</NodeArgs>
</Step>
<Step rID="T28">
<Obj plainTxt="False" ><![CDATA[住友]]></Obj>
<Details plainTxt="False" ><![CDATA[Browser]]></Details>
<Time><![CDATA[2014-8-15 - 15:24:43]]></Time>
<TimeTick>1408087483</TimeTick>
<Step rID="T29">
<Obj plainTxt="False" ><![CDATA[主页_查询中心]]></Obj>
<Details plainTxt="False" ><![CDATA[Page]]></Details>
<Time><![CDATA[2014-8-15 - 15:24:43]]></Time>
<TimeTick>1408087483</TimeTick>
<Step rID="T30">
<Obj plainTxt="False" ><![CDATA[查询中心]]></Obj>
<Details plainTxt="False" ><![CDATA[Frame]]></Details>
<Time><![CDATA[2014-8-15 - 15:24:43]]></Time>
<TimeTick>1408087483</TimeTick>
<Step rID="T31">
<Obj plainTxt="False" ><![CDATA[机号.Exist]]></Obj>
<Details plainTxt="False" ><![CDATA["Object exists"]]></Details>
<Time><![CDATA[2014-8-15 - 15:24:43]]></Time>
<TimeTick>1408087483</TimeTick>
<NodeArgs eType="Replay" icon="8" nRep="55" Source="Action1 [IntoVehiInfoFramePage]" SourceLine="17" >
<Disp><![CDATA[机号.Exist]]></Disp>
</NodeArgs>
</Step>
<Step rID="T32">
<Obj plainTxt="False" ><![CDATA[机号.Set]]></Obj>
<Details plainTxt="False" ><![CDATA["autotest"]]></Details>
<Time><![CDATA[2014-8-15 - 15:24:43]]></Time>
<TimeTick>1408087483</TimeTick>
<NodeArgs eType="Replay" icon="8" nRep="58" Source="Action1 [IntoVehiInfoFramePage]" SourceLine="18" >
<Disp><![CDATA[机号.Set]]></Disp>
</NodeArgs>
</Step>
<Step rID="T33">
<Obj plainTxt="False" ><![CDATA[唯一查询.Exist]]></Obj>
<Details plainTxt="False" ><![CDATA["Object exists"]]></Details>
<Time><![CDATA[2014-8-15 - 15:24:43]]></Time>
<TimeTick>1408087483</TimeTick>
<NodeArgs eType="Replay" icon="9" nRep="60" Source="Action1 [IntoVehiInfoFramePage]" SourceLine="20" >
<Disp><![CDATA[唯一查询.Exist]]></Disp>
</NodeArgs>
</Step>
<Step rID="T34">
<Obj plainTxt="False" ><![CDATA[唯一查询.Click]]></Obj>
<Details plainTxt="False" ><![CDATA[]]></Details>
<Time><![CDATA[2014-8-15 - 15:24:43]]></Time>
<TimeTick>1408087483</TimeTick>
<NodeArgs eType="Replay" icon="9" nRep="63" Source="Action1 [IntoVehiInfoFramePage]" SourceLine="21" >
<Disp><![CDATA[唯一查询.Click]]></Disp>
</NodeArgs>
</Step>
<NodeArgs eType="Context" icon="11" nRep="54" Source="Action1 [IntoVehiInfoFramePage]" SourceLine="17" >
<Disp><![CDATA[查询中心]]></Disp>
</NodeArgs>
</Step>
<NodeArgs eType="Context" icon="7" nRep="53" Source="Action1 [IntoVehiInfoFramePage]" SourceLine="17" >
<Disp><![CDATA[主页_查询中心]]></Disp>
</NodeArgs>
</Step>
<Step rID="T35">
<Obj plainTxt="False" ><![CDATA[主页_车辆信息]]></Obj>
<Details plainTxt="False" ><![CDATA[Page]]></Details>
<Time><![CDATA[2014-8-15 - 15:24:45]]></Time>
<TimeTick>1408087485</TimeTick>
<Step rID="T36">
<Obj plainTxt="False" ><![CDATA["您的位置>>车辆信息"- Smart Identification]]></Obj>
<Details plainTxt="False" ><![CDATA[<P><span class="text">The smart identification mechanism was invoked.</span></P><P><SPAN class=text>Reason: object not unique (2 objects found)</SPAN></P>           <SPAN class=text><b>Original description:</b></SPAN><br>micclass=WebElement<br>innertext=您的位置：&gt&gt 车辆信息<br>html tag=TD<br><P><FONT face=Verdana size=2><SPAN class=text><B>Smart Identification Alternative Description: </B></SPAN></FONT></P><FONT face=Verdana size=2><u>Base filter properties (180 objects found)&nbsp;</FONT></u><br>
micclass=WebElement<br>html tag=TD<br><br><FONT face=Verdana size=2><u>Optional filter properties</FONT></u><br>
html id=<SPAN class=passed> (Used</SPAN>, 145 matches)</SPAN><br>class=weizhi<SPAN class=passed> (Used</SPAN>, 2 matches)</SPAN><br>innertext=您的位置：&gt&gt 车辆信息<SPAN class=passed> (Used</SPAN>, 1 matches)</SPAN><br>visible=1<SPAN class=warning> (Ignored)<FONT color=#000000></FONT></SPAN><br>]]></Details>
<Time><![CDATA[2014-8-15 - 15:24:45]]></Time>
<TimeTick>1408087485</TimeTick>
<NodeArgs eType="Replay" icon="13" nRep="66" Source="Action1 [IntoVehiInfoFramePage]" SourceLine="25" >
<Disp><![CDATA["您的位置>>车辆信息"- Smart Identification]]></Disp>
</NodeArgs>
</Step>
<Step rID="T37">
<Obj plainTxt="False" ><![CDATA[您的位置>>车辆信息.Exist]]></Obj>
<Details plainTxt="False" ><![CDATA["Object exists"]]></Details>
<Time><![CDATA[2014-8-15 - 15:24:45]]></Time>
<TimeTick>1408087485</TimeTick>
<NodeArgs eType="Replay" icon="12" nRep="67" Source="Action1 [IntoVehiInfoFramePage]" SourceLine="25" >
<Disp><![CDATA[您的位置>>车辆信息.Exist]]></Disp>
</NodeArgs>
</Step>
<Step rID="T38">
<Obj plainTxt="False" ><![CDATA["您的位置>>车辆信息"- Smart Identification]]></Obj>
<Details plainTxt="False" ><![CDATA[<P><span class="text">The smart identification mechanism was invoked.</span></P><P><SPAN class=text>Reason: object not unique (2 objects found)</SPAN></P>           <SPAN class=text><b>Original description:</b></SPAN><br>micclass=WebElement<br>innertext=您的位置：&gt&gt 车辆信息<br>html tag=TD<br><P><FONT face=Verdana size=2><SPAN class=text><B>Smart Identification Alternative Description: </B></SPAN></FONT></P><FONT face=Verdana size=2><u>Base filter properties (180 objects found)&nbsp;</FONT></u><br>
micclass=WebElement<br>html tag=TD<br><br><FONT face=Verdana size=2><u>Optional filter properties</FONT></u><br>
html id=<SPAN class=passed> (Used</SPAN>, 145 matches)</SPAN><br>class=weizhi<SPAN class=passed> (Used</SPAN>, 2 matches)</SPAN><br>innertext=您的位置：&gt&gt 车辆信息<SPAN class=passed> (Used</SPAN>, 1 matches)</SPAN><br>visible=1<SPAN class=warning> (Ignored)<FONT color=#000000></FONT></SPAN><br>]]></Details>
<Time><![CDATA[2014-8-15 - 15:24:45]]></Time>
<TimeTick>1408087485</TimeTick>
<NodeArgs eType="Replay" icon="13" nRep="69" Source="Action1 [IntoVehiInfoFramePage]" SourceLine="26" >
<Disp><![CDATA["您的位置>>车辆信息"- Smart Identification]]></Disp>
</NodeArgs>
</Step>
<NodeArgs eType="Context" icon="7" nRep="65" Source="Action1 [IntoVehiInfoFramePage]" SourceLine="25" >
<Disp><![CDATA[主页_车辆信息]]></Disp>
</NodeArgs>
</Step>
<NodeArgs eType="Context" icon="6" nRep="52" Source="Action1 [IntoVehiInfoFramePage]" SourceLine="17" >
<Disp><![CDATA[住友]]></Disp>
</NodeArgs>
</Step>
<Step rID="T39">
<Obj ><![CDATA[进入车辆信息页成功]]></Obj>
<Details ><![CDATA[期望位置:您的位置：>> 车辆信息  实际位置:您的位置：>> 车辆信息]]></Details>
<Time><![CDATA[2014-8-15 - 15:24:45]]></Time>
<TimeTick>1408087485</TimeTick>
<NodeArgs eType="User" icon="10" nRep="70" status="Passed" Source="Action1 [IntoVehiInfoFramePage]" SourceLine="28" >
<Disp><![CDATA[进入车辆信息页成功]]></Disp>
</NodeArgs>
</Step>
<Summary sTime="2014-8-15 - 15:24:41" eTime="2014-8-15 - 15:24:45" passed="2" failed="0" warnings="0" ></Summary>
<NodeArgs eType="StartAction" icon="4" nRep="36" status="Passed" >
<Disp><![CDATA[Action1 [IntoVehiInfoFramePage] Summary]]></Disp>
</NodeArgs>
</Action>
<Action rID="T40">
<AName><![CDATA[Action1 [QueryLockUnlockSetSourMsgID]]]></AName>
<Summary sTime="2014-8-15 - 15:24:45" eTime="2014-8-15 - 15:24:45" passed="0" failed="0" warnings="0" ></Summary>
<NodeArgs eType="StartAction" icon="4" nRep="72" >
<Disp><![CDATA[Action1 [QueryLockUnlockSetSourMsgID] Summary]]></Disp>
</NodeArgs>
</Action>
<Action rID="T41">
<AName><![CDATA[Action1 [SetBaoYangTime]]]></AName>
<Step rID="T42">
<Obj plainTxt="False" ><![CDATA[住友]]></Obj>
<Details plainTxt="False" ><![CDATA[Browser]]></Details>
<Time><![CDATA[2014-8-15 - 15:24:46]]></Time>
<TimeTick>1408087486</TimeTick>
<Step rID="T43">
<Obj plainTxt="False" ><![CDATA[主页_车辆信息]]></Obj>
<Details plainTxt="False" ><![CDATA[Page]]></Details>
<Time><![CDATA[2014-8-15 - 15:24:46]]></Time>
<TimeTick>1408087486</TimeTick>
<Step rID="T44">
<Obj plainTxt="False" ><![CDATA[最新提交_.Exist]]></Obj>
<Details plainTxt="False" ><![CDATA["Object exists"]]></Details>
<Time><![CDATA[2014-8-15 - 15:24:46]]></Time>
<TimeTick>1408087486</TimeTick>
<NodeArgs eType="Replay" icon="12" nRep="78" Source="Action1 [SetBaoYangTime]" SourceLine="6" >
<Disp><![CDATA[最新提交_.Exist]]></Disp>
</NodeArgs>
</Step>
<Step rID="T45">
<Obj plainTxt="False" ><![CDATA[最新提交_.Click]]></Obj>
<Details plainTxt="False" ><![CDATA[]]></Details>
<Time><![CDATA[2014-8-15 - 15:24:46]]></Time>
<TimeTick>1408087486</TimeTick>
<NodeArgs eType="Replay" icon="12" nRep="81" Source="Action1 [SetBaoYangTime]" SourceLine="7" >
<Disp><![CDATA[最新提交_.Click]]></Disp>
</NodeArgs>
</Step>
<Step rID="T46">
<Obj plainTxt="False" ><![CDATA[最新提交_设置保养剩余时间.Exist]]></Obj>
<Details plainTxt="False" ><![CDATA["Object exists"]]></Details>
<Time><![CDATA[2014-8-15 - 15:24:46]]></Time>
<TimeTick>1408087486</TimeTick>
<NodeArgs eType="Replay" icon="14" nRep="83" Source="Action1 [SetBaoYangTime]" SourceLine="10" >
<Disp><![CDATA[最新提交_设置保养剩余时间.Exist]]></Disp>
</NodeArgs>
</Step>
<Step rID="T47">
<Obj plainTxt="False" ><![CDATA[最新提交_设置保养剩余时间.Click]]></Obj>
<Details plainTxt="False" ><![CDATA[]]></Details>
<Time><![CDATA[2014-8-15 - 15:24:46]]></Time>
<TimeTick>1408087486</TimeTick>
<NodeArgs eType="Replay" icon="14" nRep="86" Source="Action1 [SetBaoYangTime]" SourceLine="11" >
<Disp><![CDATA[最新提交_设置保养剩余时间.Click]]></Disp>
</NodeArgs>
</Step>
<Step rID="T48">
<Obj plainTxt="False" ><![CDATA[主页_车辆信息.Sync]]></Obj>
<Details plainTxt="False" ><![CDATA[]]></Details>
<Time><![CDATA[2014-8-15 - 15:24:47]]></Time>
<TimeTick>1408087487</TimeTick>
<NodeArgs eType="Replay" icon="7" nRep="89" Source="Action1 [SetBaoYangTime]" SourceLine="13" >
<Disp><![CDATA[主页_车辆信息.Sync]]></Disp>
</NodeArgs>
</Step>
<Step rID="T49">
<Obj plainTxt="False" ><![CDATA[Stop Run]]></Obj>
<Details plainTxt="False" ><![CDATA[Run stopped by user.]]></Details>
<Time><![CDATA[2014-8-15 - 15:24:47]]></Time>
<TimeTick>1408087487</TimeTick>
<NodeArgs eType="General" icon="15" nRep="90" >
<Disp><![CDATA[Stop Run]]></Disp>
</NodeArgs>
</Step>
<NodeArgs eType="Context" icon="7" nRep="77" Source="Action1 [SetBaoYangTime]" SourceLine="6" >
<Disp><![CDATA[主页_车辆信息]]></Disp>
</NodeArgs>
</Step>
<NodeArgs eType="Context" icon="6" nRep="76" Source="Action1 [SetBaoYangTime]" SourceLine="6" >
<Disp><![CDATA[住友]]></Disp>
</NodeArgs>
</Step>
<Summary sTime="2014-8-15 - 15:24:46" eTime="2014-8-15 - 15:24:47" passed="0" failed="0" warnings="0" ></Summary>
<NodeArgs eType="StartAction" icon="4" nRep="74" >
<Disp><![CDATA[Action1 [SetBaoYangTime] Summary]]></Disp>
</NodeArgs>
</Action>
<Step rID="T50">
<Obj plainTxt="False" ><![CDATA[Stop Run]]></Obj>
<Details plainTxt="False" ><![CDATA[Run stopped by user.]]></Details>
<Time><![CDATA[2014-8-15 - 15:24:47]]></Time>
<TimeTick>1408087487</TimeTick>
<NodeArgs eType="General" icon="15" nRep="92" >
<Disp><![CDATA[Stop Run]]></Disp>
</NodeArgs>
</Step>
<Summary sTime="2014-8-15 - 15:24:27" eTime="2014-8-15 - 15:24:47" passed="0" failed="0" warnings="0" ></Summary>
<NodeArgs eType="StartAction" icon="3" nRep="6" status="Passed" >
<Disp><![CDATA[Action1 Summary]]></Disp>
</NodeArgs>
</Action>
<Step rID="T51">
<Obj plainTxt="False" ><![CDATA[Stop Run]]></Obj>
<Details plainTxt="False" ><![CDATA[Run stopped by user.]]></Details>
<Time><![CDATA[2014-8-15 - 15:24:47]]></Time>
<TimeTick>1408087487</TimeTick>
<NodeArgs eType="General" icon="16" nRep="94" >
<Disp><![CDATA[Stop Run]]></Disp>
</NodeArgs>
</Step>
<Summary sTime="2014-8-15 - 15:24:26" eTime="2014-8-15 - 15:24:47" passed="4" failed="0" warnings="0" stopped="True" ></Summary>
<NodeArgs eType="StartTest" icon="1" nRep="3" status="Passed" >
<Disp><![CDATA[Test Case3_VehiMsg_LastSubm_BaoYangTimeSetAndReply Summary]]></Disp>
</NodeArgs>
</Doc>
</Report>